{
  "schema_version": "loveengine.local-loop-transcript/1",
  "run_id": "local-loop-001",
  "manifest_hash": "sha256:6770c0b100a9dc0ed39c41997826455ebf925147b4ecb78aa23933bf7e7ac2ca",
  "chain_id": "31337",
  "contracts": {
    "StreamingEngine": "0x5FbDB2315678afecb367f032d93F642f64180aa3",
    "PublicSink": "0xe7f1725E7734CE288F8367e1Bb143E90bb3F0512",
    "CorporateSink": "0x9fE46736679d2D9a65F0992F2272dE9f3c7fa6e0",
    "WitnessDAO": "0xCf7Ed3AccA5a467e9e704C703E8D87F634fB0Fc9"
  },
  "events": [
    {
      "action": "deploy StreamingEngine",
      "transaction_hash": "ba12c7410498e20eaa2365c38862fb39353c21949362f9576888fa6fdb00e604",
      "block_number": "1",
      "status": "1"
    },
    {
      "action": "deploy PublicSink",
      "transaction_hash": "9b4a2f6dfe90de1b28c8e392e071627b939fbdeb2d22f3c3f17f313043edf270",
      "block_number": "2",
      "status": "1"
    },
    {
      "action": "deploy CorporateSink",
      "transaction_hash": "d53dafbc8b5d27033309983461faaf679c823724b74f7fdbb00d7344688932c8",
      "block_number": "3",
      "status": "1"
    },
    {
      "action": "deploy WitnessDAO",
      "transaction_hash": "c717843c942d805b1505768d21f1316bc0e532776cf0b033bb54ef8b56d47051",
      "block_number": "4",
      "status": "1"
    },
    {
      "action": "bind StreamingEngine",
      "transaction_hash": "bfd2b4b342ac5aabac6715148b8b53ab5db4427d7bf770014b811bdd90225a27",
      "block_number": "5",
      "status": "1"
    },
    {
      "action": "bind CorporateSink",
      "transaction_hash": "6b8b66b11240d276ed7c8b80b046b8bb267e8da4d2ec12c3e6b3e2fb6db1e229",
      "block_number": "6",
      "status": "1"
    },
    {
      "action": "batchRegister",
      "transaction_hash": "d4b5542e62e8ff5bc756cf810d828b478d4f269ffd5ca6a4b968930405852dd7",
      "block_number": "7",
      "status": "1"
    },
    {
      "action": "scheduleBroadcast",
      "transaction_hash": "bb85aa657cdde830836ce3e138e341e8b98a12405c22070d20f032fc3c9b0826",
      "block_number": "8",
      "status": "1"
    },
    {
      "action": "proposeUserCount",
      "transaction_hash": "36dd0f6cf1cf5c464ed4533c83f0ccc74157ed12f6caaf38ae553653fde2282e",
      "block_number": "10",
      "status": "1"
    },
    {
      "action": "batchVote",
      "transaction_hash": "7c874fd123764ae50d084b898105f4325942e54da3d24133e7eb027e25a8a2b8",
      "block_number": "11",
      "status": "1"
    }
  ],
  "evidence_bundle": {
    "schema_version": "loveengine.evidence-bundle/1",
    "bundle_id": "local-loop-evidence-001",
    "session_id": "local-loop-session-001",
    "proposal_type": "USER_COUNT",
    "subject": {
      "corporate": "0x9fE46736679d2D9a65F0992F2272dE9f3c7fa6e0",
      "new_user_count": "20"
    },
    "source_refs": [
      "fixture://local-loop-session-001"
    ],
    "attachments": [],
    "summary": {
      "kind": "summary",
      "text": "Local deterministic witness-loop fixture."
    },
    "created_at": "2026-06-22T08:35:57.781584Z",
    "payload_hash": "0xcb633a1fbe001ce43cf242b352a0e28270cb0e2786fc314e316ad3ff81dc1b3b",
    "artifact_hash": "sha256:8ee447c4d0dfb3f53c4b9b61bc067d5cadf71550bd82857de8b90c126d63b50d"
  },
  "proposal": {
    "proposal_id": "1",
    "payload_hash": "0xa43ed3d4bd0f22212b215ad792cd73543f2aa88a72ebaa35fb48727bbe13d20b",
    "total_votes": "5",
    "support_votes": "5"
  },
  "votes": [
    {
      "witness": "0x3C44CdDdB6a900fa2b585dd299e03d12FA4293BC",
      "support": true,
      "nonce": "0",
      "deadline": "1783330557"
    },
    {
      "witness": "0x90F79bf6EB2c4f870365E785982E1f101E93b906",
      "support": true,
      "nonce": "0",
      "deadline": "1783330557"
    },
    {
      "witness": "0x15d34AAf54267DB7D7c367839AAf71A00a2C6A65",
      "support": true,
      "nonce": "0",
      "deadline": "1783330557"
    },
    {
      "witness": "0x9965507D1a55bcC2695C58ba16FB37d819B0A4dc",
      "support": true,
      "nonce": "0",
      "deadline": "1783330557"
    },
    {
      "witness": "0x976EA74026E726554dB657fA54763abd0C3a0aa9",
      "support": true,
      "nonce": "0",
      "deadline": "1783330557"
    }
  ],
  "final_state": {
    "registered_witness_count": "5",
    "proposal_executed": true,
    "rate": "20000000000000",
    "total_uto": "12096010000000000000"
  },
  "transcript_hash": "sha256:7bbbc5671369339240c186e3151805da5cad072c5ed79d1185242e663f808379"
}
